{
  "schemaVersion": 1,
  "codeVersion": "2.4.0",
  "releaseId": "01J8QK3F9G7XA6P0V6ZC9N6R4T",
  "generatedAt": "2026-06-01T12:00:00Z",
  "artifacts": {
    "controlPlaneImage": {
      "path": "control-plane.oci.tar.zst",
      "digest": "sha256:9682666514c07508d9ee41ca0a32cf2fc8e0fbda9466c5bfd0f88b82ca5389e9",
      "sizeBytes": 104857600,
      "signature": "control-plane.oci.tar.zst.sig"
    },
    "uiImage": {
      "path": "appliance-ui.oci.tar.zst",
      "digest": "sha256:3682666514c07508d9ee41ca0a32cf2fc8e0fbda9466c5bfd0f88b82ca5389e9",
      "sizeBytes": 16777216,
      "signature": "appliance-ui.oci.tar.zst.sig"
    },
    "hostAgentImage": {
      "path": "appliance-host-agent.oci.tar.zst",
      "digest": "sha256:4682666514c07508d9ee41ca0a32cf2fc8e0fbda9466c5bfd0f88b82ca5389e9",
      "sizeBytes": 8388608,
      "imageReference": "registry.local/appliance-host-agent@sha256:dddddddddddddddddddddddddddddddddddddddddddddddddddddddddddddddd"
    },
    "hostAgentBinary": {
      "path": "appliance-host-agentd",
      "digest": "sha256:5682666514c07508d9ee41ca0a32cf2fc8e0fbda9466c5bfd0f88b82ca5389e9",
      "sizeBytes": 4194304
    },
    "hostPackages": {
      "path": "host-packages/",
      "manifestDigest": "sha256:6682666514c07508d9ee41ca0a32cf2fc8e0fbda9466c5bfd0f88b82ca5389e9"
    },
    "applianceChart": {
      "path": "appliance-chart-2.4.0.tgz",
      "digest": "sha256:cc57fc1903e444cf6a726490b43b27ee9f87facc037f86872201847c565b45fb",
      "sizeBytes": 65536
    },
    "artifactServerImage": {
      "path": "artifact-server.oci.tar.zst",
      "digest": "sha256:ac57fc1903e444cf6a726490b43b27ee9f87facc037f86872201847c565b45fb",
      "sizeBytes": 52428800,
      "imageReference": "registry.local/artifact-server@sha256:aaaaaaaaaaaaaaaaaaaaaaaaaaaaaaaaaaaaaaaaaaaaaaaaaaaaaaaaaaaaaaaa"
    },
    "artifactServerChart": {
      "path": "appliance-registry-2.1.7.tgz",
      "digest": "sha256:bc57fc1903e444cf6a726490b43b27ee9f87facc037f86872201847c565b45fb",
      "sizeBytes": 32768
    },
    "dnsImage": {
      "path": "coredns.oci.tar.zst",
      "digest": "sha256:dc57fc1903e444cf6a726490b43b27ee9f87facc037f86872201847c565b45fb",
      "sizeBytes": 20971520,
      "imageReference": "registry.local/coredns@sha256:cccccccccccccccccccccccccccccccccccccccccccccccccccccccccccccccc"
    },
    "dnsChart": {
      "path": "appliance-dns-1.14.4.tgz",
      "digest": "sha256:ec57fc1903e444cf6a726490b43b27ee9f87facc037f86872201847c565b45fb",
      "sizeBytes": 16384
    },
    "blobStorageImage": {
      "path": "blob-storage.oci.tar.zst",
      "digest": "sha256:ac47fc1903e444cf6a726490b43b27ee9f87facc037f86872201847c565b45fb",
      "sizeBytes": 62914560,
      "imageReference": "registry.local/blob-storage@sha256:abababababababababababababababababababababababababababababababab"
    },
    "metadataBundle": {
      "path": "appliance-metadata-bundle-2.4.0.0.tar.zst",
      "digest": "sha256:ee165ffe5b174c9ba1756b3eca14abdb87a8df4e93aef2f1c61aa76590b50cdd",
      "sizeBytes": 1370
    },
    "configurationSchema": {
      "path": "configuration.schema.json",
      "digest": "sha256:cbe0d029431ea4c792ecc23daf793f18bd5b57eed6c8419ac5a89b1cdf40c25c",
      "sizeBytes": 4096
    },
    "compatibility": {
      "path": "compatibility.json",
      "digest": "sha256:fa528d3adef61d199a8348ffb48ef0143603ea2e0ad007121c39edc6e3aeb567",
      "sizeBytes": 1024
    },
    "checksums": {
      "path": "checksums.txt",
      "digest": "sha256:d3beb16ca27a9fc332b55f526e1c8da6db0b2f58d50c9d27d59e15e23a4e35a8",
      "sizeBytes": 2048
    },
    "sbom": {
      "path": "sbom/",
      "manifestDigest": "sha256:98f3ae1ef67113d8140d4f6cb8d2830070e21ea48f091be519659846c771a374"
    },
    "provenance": {
      "path": "provenance/",
      "manifestDigest": "sha256:96d815328a42cb4ef89d5e0b7a1df6be43b484832c83a7b4596d8402c7c0b12b"
    },
    "notices": {
      "path": "notices/",
      "manifestDigest": "sha256:7367ab9a454559025d4d8ee2241d74682674f0e62c344695d23cfb2f080dd0a9"
    },
    "tests": {
      "path": "tests/",
      "manifestDigest": "sha256:59830ebc3a4184110566bf1a290d08473dfdcbd492ce498b14cd1a5e2fa2e441"
    },
    "inferenceRuntimeImage": {
      "path": "inference-runtime.oci.tar.zst",
      "digest": "sha256:fc57fc1903e444cf6a726490b43b27ee9f87facc037f86872201847c565b45fb",
      "sizeBytes": 31457280,
      "imageReference": "registry.local/inference-runtime@sha256:eeeeeeeeeeeeeeeeeeeeeeeeeeeeeeeeeeeeeeeeeeeeeeeeeeeeeeeeeeeeeeee"
    },
    "inferenceManagerImage": {
      "path": "inference-manager.oci.tar.zst",
      "digest": "sha256:0d57fc1903e444cf6a726490b43b27ee9f87facc037f86872201847c565b45fb",
      "sizeBytes": 1048576,
      "imageReference": "registry.local/inference-manager@sha256:ffffffffffffffffffffffffffffffffffffffffffffffffffffffffffffffff"
    },
    "inferenceChart": {
      "path": "appliance-inference-0.6.5.tgz",
      "digest": "sha256:0c57fc1903e444cf6a726490b43b27ee9f87facc037f86872201847c565b45fb",
      "sizeBytes": 16384
    }
  },
  "compatibility": {
    "k3sVersion": "v1.30.4+k3s1",
    "chartVersion": "2.4.0",
    "artifactServerVersion": "2.1.7",
    "dnsVersion": "1.14.4",
    "supportedUpgradeSources": [
      "2.3.0",
      "2.3.1"
    ],
    "inferenceVersion": "0.6.5"
  }
}
